{
  "$schema": "https://testatlas.dev/schemas/v1/workspace-manifest.schema.json",
  "suite": "TestAtlas",
  "workspaceVersion": "1",
  "workspaceDir": "_testatlas",
  "initializedAt": "2026-05-03T00:00:00.000Z",
  "lastUpdatedAt": "2026-05-03T00:00:00.000Z",
  "project": {
    "name": "TestAtlas",
    "root": ".",
    "detectedStack": [],
    "packageManagers": [],
    "runtimes": []
  },
  "counts": {
    "domains": 2,
    "flows": 4,
    "issues": 2,
    "evidenceRecords": 1,
    "testRuns": 0
  },
  "latestReport": null,
  "status": "initialized",
  "generatedSections": {
    "_testatlas/00_overview.md": {
      "current-status": "4fc3cd82d647074257c7b9c1c9ae51de9346d16ad2afb322c8828df5536a193c",
      "latest-report-pointer": "849f86780034fbe2bf69243739b2385bc14627f0e1afc35e692ad3b7c08405ec",
      "last-updated": "b2acf42260643ff7d5f5a019682e74f7cfbeb01e019defc52cc3993e2a3883d2"
    },
    "_testatlas/01_system_map.md": {
      "source-references": "d60398288f929323b814bbef0c65328a39b5bb1bc5ccafcb5571d59b621aa5ff"
    },
    "_testatlas/03_execution_status.md": {
      "current-run": "3bb0a4ed34b49dc657771dc1d0bad384d9b036d7d6eb5ee00a28072e68969da4",
      "completed-explorations": "a06ed5db3ceda2f0c6e05c6af909b5effc6db4ea32143babf6866eac7139c18a",
      "domains-mapped": "c99377464d01af92ab5fde699e1634f443ad1637706bb0bd2321b5b5dee58e55",
      "flows-mapped": "64489410bf5b084d01304de8e7fbfbad7d946df8c95f21715b9f345f76b0f8da",
      "flows-tested": "2dabcce1965180e13d008f73adc49ae0e7d9b19983ef731e343d0efe93552f21",
      "issues-filed": "9d941eba6da8b5d49606eeb3a4773c6ece8ba4d58e3a2ce5d75bc0697da57225",
      "pending-retests": "2be28eddd1b0c284caacf80c69feb2a8688b7d98c9be86d23dd50b1beefa655b",
      "blockers": "4973501cf9d1fe886700dc9f8617f93044aed23313ea262dae619c48e3fa9e1f",
      "next-steps": "5bcb79fe6c514568eb2dce19f1bd1c9e39b058a92f6f00599485d4cded8b7be3",
      "last-updated": "b2acf42260643ff7d5f5a019682e74f7cfbeb01e019defc52cc3993e2a3883d2"
    },
    "_testatlas/09_artifact_index.md": {
      "canonical-docs": "c7c23843a7a11c4972afd09a60c1931b36002f097b4ee382708a3779b1ae4749",
      "domain-docs": "c99377464d01af92ab5fde699e1634f443ad1637706bb0bd2321b5b5dee58e55",
      "flow-docs": "64489410bf5b084d01304de8e7fbfbad7d946df8c95f21715b9f345f76b0f8da",
      "issue-docs": "9d941eba6da8b5d49606eeb3a4773c6ece8ba4d58e3a2ce5d75bc0697da57225",
      "evidence": "bc8b577346b452de41218957a6dc7348de68adfb47098752ec01022684331d5a",
      "reports": "ef05d2b58e02f519b8c24d60b46a8e09b0bdc9816b5da3f8d35c0f4512cf0fe2",
      "json-maps": "c4af485db8a628f20af104abdb3c0f870021e72df15969b096dbff4b6fc299cf",
      "command-outputs": "c00b53b8f1ae74c1af9eb0010980e08dc1465dcfb828cdcfdd8a0355b51ebcf5",
      "sub-agent-outputs": "20264dd605531bc70bf0af03afc3c7db1f7c7d8d34002e2c501c0647bcf15393"
    },
    "_testatlas/10_command_log.md": {
      "entries": "fd2da5b31c9ebc4ec4c9cd49c36c95dafb9784b897d549a67a4bf3cd5f429b20"
    },
    "_testatlas/13_quality_scorecard.md": {
      "coverage": "36586ce9290b9b02e286413ee6a3c050d77f88f642e4ced0e707fc7acf5842a3",
      "severity-weighted-issue-load": "baf08e65c356fdfa89bd0ba050a981fd12a5228b941ed7d13c0d36ab87336456",
      "confidence-trend": "18f70c6c5a223da7e186437fa2685aa774f52cc2a1eb6f21a076301e68889d3d",
      "blockers-trend": "d87749fa56f5762b63f6850541e24167eb73e41005a4c11d2af8372686e3d0cd",
      "last-updated": "b2acf42260643ff7d5f5a019682e74f7cfbeb01e019defc52cc3993e2a3883d2"
    },
    "09_artifact_index.md": {
      "domain-docs": "9f4371bbce271d3f5b0517b414db12e907b6ca74de7b22d8887f4215a42f7c53",
      "flow-docs": "1f1b1292f0aff37b6b38a9f24db440eb9692b5bf3b96d0ed0db2b94ce431bc9f",
      "issue-docs": "f0759c7f455a20fdd9016907d92ed50c9de4ab12f31d07189322489fc6edefdb",
      "evidence": "feb4a796c76dba771efc29ade20f526d911af4d627bb01fce5a66cb14042ab10",
      "reports": "7df62e93006bdb542ff4bb8ac2a1ccdcd8126c24d7f96d1743a32032570a6750",
      "canonical-docs": "c4720f34c70e453a54fa30f715ee2d5257067879ab847871fb8e9f27d5b0fcfb",
      "json-maps": "15b685212a857a7901b8dc758df902892a5f23c407568f587c39bb041566eb24",
      "command-outputs": "faae5d1bc4a946c2ef744eb6038f8a7a8b4df5e77948a2c643707da9d82d5eba",
      "sub-agent-outputs": "7293b483d652313ba75eddb16f367936e85b33bf106223f895f1b7dd82ea040e"
    }
  }
}
